offer_code,business_unit,offer_name,category,description,price_model,price_min_usd,price_max_usd,deposit_type,deposit_value,intake_form_url,booking_url,cta,sla_notes
RNG-MINI-REPLICA,rosser_nft_gallery,Mini Replica,Gallery Products,Completed mini replica from available catalog designs,fixed,75,600,full_payment,100,https://rossernftgallery.com/?offer=RNG-MINI-REPLICA,https://calendar.app.google/afjkNdXsLSWYibfUA,Buy now / reserve from catalog,Inventory turnaround listed on product page
RNG-COMMISSION-SCULPTURE,rosser_nft_gallery,Custom Sculpture Commission,Commissions,Custom physical sculpture scoped by size/material,range,500,10000,percent,50,https://rossernftgallery.com/?offer=RNG-COMMISSION-SCULPTURE,https://calendar.app.google/afjkNdXsLSWYibfUA,Request quote + pay deposit,2-12 weeks depending on size/material
RNG-HISTORICAL-PRESERVATION,rosser_nft_gallery,Historical Preservation + Replica,Preservation,Preservation-focused digitization + replica production,custom,500,25000,percent,40,https://rossernftgallery.com/?offer=RNG-HISTORICAL-PRESERVATION,https://calendar.app.google/afjkNdXsLSWYibfUA,Book preservation consult,2-8 weeks by object complexity
RNG-PRIVATE-EVENT-RENTAL,rosser_nft_gallery,Private Event Rental,Events,Private use of gallery location with agreed setup window,range,250,2500,percent,30,https://rossernftgallery.com/?offer=RNG-PRIVATE-EVENT-RENTAL,https://calendar.app.google/afjkNdXsLSWYibfUA,Request event date hold,Date hold response within 1 business day
RTS-QUICK-WEBSITE-SPRINT,rt_solutions,Quick Website Launch Sprint,Web Services,Fast-launch business website with core pages and lead form,tiered,1500,6000,percent,50,https://rossertech.netlify.app/?offer=RTS-QUICK-WEBSITE-SPRINT,https://calendar.app.google/afjkNdXsLSWYibfUA,Book sprint intake + pay deposit,7-14 days after approved intake
RTS-AI-LUNCH-LEARN,rt_solutions,AI Lunch-and-Learn,Education,60-90 minute live AI session tailored to audience,range,500,2500,percent,40,https://rossertech.netlify.app/?offer=RTS-AI-LUNCH-LEARN,https://calendar.app.google/afjkNdXsLSWYibfUA,Book workshop call,Outline delivered in 2-5 business days
RTS-AI-TEAM-TRAINING,rt_solutions,AI Team Training Workshop,Education,Half-day or full-day team training with practical workflows,range,1500,7500,percent,40,https://rossertech.netlify.app/?offer=RTS-AI-TEAM-TRAINING,https://calendar.app.google/afjkNdXsLSWYibfUA,Request training proposal,Training plan in 3-5 business days
RTS-CUSTOM-BUILD-DISCOVERY,rt_solutions,Custom Software + AI Build Discovery,Software Services,Paid discovery followed by scoped implementation proposal,custom,500,30000,fixed,500,https://rossertech.netlify.app/?offer=RTS-CUSTOM-BUILD-DISCOVERY,https://calendar.app.google/afjkNdXsLSWYibfUA,Book discovery,Discovery summary in 5 business days
